{
  "id": "security-engineer",
  "title_he": "מהנדס/ת סייבר ואבטחת מידע",
  "title_en": "Cybersecurity Engineer",
  "description_he": "הגנה על מערכות מפני תוקפים — בדיקות חדירה, ניתוח לוגים, תגובה לאירועי אבטחה, ובניית מערכות הגנה. תחום שבישראל יש בו ביקוש גבוה במיוחד בגלל הרקע הצבאי של חלק גדול מהמועסקים. דורש סקרנות, חשיבה אדברסרית, ועדכניות מתמדת.",
  "riasec_affinity": { "R": 0.50, "I": 0.95, "A": 0.20, "S": 0.20, "E": 0.40, "C": 0.65 },
  "required_skills": [
    { "skill_id": "cybersecurity", "importance": 1.0 },
    { "skill_id": "linux-cli", "importance": 0.85 },
    { "skill_id": "programming-general", "importance": 0.7 },
    { "skill_id": "problem-solving", "importance": 0.85 },
    { "skill_id": "english-business", "importance": 0.75 }
  ],
  "desired_skills": [
    { "skill_id": "cloud", "importance": 0.6 },
    { "skill_id": "python", "importance": 0.5 },
    { "skill_id": "research-skills", "importance": 0.65 }
  ],
  "values_fit": ["money", "challenge", "impact", "learning"],
  "big5_fit": { "O": 70, "C": 70 },
  "constraints": {
    "typical_training_months": 12,
    "typical_training_cost_nis": 35000,
    "requires_english_level": "advanced",
    "remote_ok": true,
    "typical_locations": ["מרכז", "תל אביב", "שרון", "חיפה", "באר שבע"]
  },
  "market": {
    "demand_he": "very_high",
    "typical_salary_nis_min": 22000,
    "typical_salary_nis_max": 60000,
    "ai_risk": "low"
  },
  "data_source": "public_knowledge_v1_2026-05",
  "last_verified_at": "2026-05-21"
}
