{
  "id": "dental-technician",
  "title_he": "טכנאי/ת שיניים",
  "title_en": "Dental Technician",
  "description_he": "עיצוב וייצור של שיניים תותבות, כתרים, גשרים ומכשירים אורתודונטיים במעבדת שיניים. עבודה מדויקת עם הידיים בשילוב טכנולוגיה חדשה (הדפסות תלת-מימד, סריקות דיגיטליות). תפקיד למי שאוהב/ת עבודה עם פרטים קטנים ואומנות טכנית, בלי מגע ישיר עם מטופלים.",
  "riasec_affinity": { "R": 0.80, "I": 0.50, "A": 0.60, "S": 0.20, "E": 0.20, "C": 0.75 },
  "required_skills": [
    { "skill_id": "manual-dexterity", "importance": 1.0 },
    { "skill_id": "attention-to-detail", "importance": 0.95 },
    { "skill_id": "anatomy", "importance": 0.6 },
    { "skill_id": "tool-use", "importance": 0.8 }
  ],
  "desired_skills": [
    { "skill_id": "3d-modeling", "importance": 0.5 },
    { "skill_id": "patience", "importance": 0.7 },
    { "skill_id": "artistic-ability", "importance": 0.6 }
  ],
  "values_fit": ["money", "stability", "craftsmanship"],
  "big5_fit": { "C": 80, "O": 55 },
  "constraints": {
    "typical_training_months": 24,
    "typical_training_cost_nis": 25000,
    "requires_english_level": "basic",
    "remote_ok": false,
    "typical_locations": ["מרכז", "תל אביב", "שרון", "ירושלים", "חיפה", "באר שבע"]
  },
  "market": {
    "demand_he": "medium",
    "typical_salary_nis_min": 11000,
    "typical_salary_nis_max": 22000,
    "ai_risk": "medium"
  },
  "data_source": "public_knowledge_v1_2026-05",
  "last_verified_at": "2026-09-03"
}
