{
  "id": "auto-mechanic",
  "title_he": "מכונאי/ת רכב",
  "title_en": "Auto Mechanic",
  "description_he": "אבחון ותיקון תקלות ברכבים. עולם שמשנה את עצמו עם המעבר לרכבים חשמליים והיברידיים — יש בו עתיד למי שלומד את הטכנולוגיה החדשה. שילוב של חשיבה לוגית עם עבודת ידיים, ואפשרות לפתוח מוסך עצמאי בהמשך.",
  "riasec_affinity": { "R": 0.95, "I": 0.50, "A": 0.10, "S": 0.20, "E": 0.30, "C": 0.55 },
  "required_skills": [
    { "skill_id": "auto-mechanics", "importance": 1.0 },
    { "skill_id": "tool-use", "importance": 0.95 },
    { "skill_id": "problem-solving", "importance": 0.85 },
    { "skill_id": "manual-dexterity", "importance": 0.85 }
  ],
  "desired_skills": [
    { "skill_id": "customer-service", "importance": 0.45 },
    { "skill_id": "safety", "importance": 0.7 }
  ],
  "values_fit": ["money", "stability", "challenge"],
  "constraints": {
    "typical_training_months": 24,
    "typical_training_cost_nis": 20000,
    "requires_english_level": "basic",
    "remote_ok": false,
    "typical_locations": ["כל הארץ"]
  },
  "market": {
    "demand_he": "medium",
    "typical_salary_nis_min": 9000,
    "typical_salary_nis_max": 22000,
    "ai_risk": "medium"
  },
  "data_source": "public_knowledge_v1_2026-05",
  "last_verified_at": "2026-05-21"
}
