{
  "id": "occupational-therapist",
  "title_he": "מרפא/ה בעיסוק",
  "title_en": "Occupational Therapist",
  "description_he": "טיפול באנשים — ילדים, מבוגרים, או קשישים — שצריכים לחזור לתפקוד יומיומי אחרי פציעה, מחלה, או עקב התפתחות שונה. עבודה קרובה ואישית, עם ראייה הוליסטית של אדם. תואר אקדמי מלא חובה, אבל המקצוע יציב, מבוקש, ויש בו תרומה אמיתית.",
  "riasec_affinity": { "R": 0.30, "I": 0.55, "A": 0.50, "S": 0.95, "E": 0.25, "C": 0.50 },
  "required_skills": [
    { "skill_id": "ot-practice", "importance": 1.0 },
    { "skill_id": "empathy", "importance": 0.95 },
    { "skill_id": "anatomy", "importance": 0.7 },
    { "skill_id": "communication", "importance": 0.85 },
    { "skill_id": "patience", "importance": 0.85 }
  ],
  "desired_skills": [
    { "skill_id": "child-development", "importance": 0.6 },
    { "skill_id": "creativity", "importance": 0.5 }
  ],
  "values_fit": ["impact", "service", "stability", "team"],
  "big5_fit": { "A": 75, "C": 65 },
  "constraints": {
    "typical_training_months": 48,
    "typical_training_cost_nis": 60000,
    "requires_english_level": "basic",
    "remote_ok": false,
    "typical_locations": ["כל הארץ"]
  },
  "market": {
    "demand_he": "high",
    "typical_salary_nis_min": 11000,
    "typical_salary_nis_max": 22000,
    "ai_risk": "low"
  },
  "data_source": "public_knowledge_v1_2026-05",
  "last_verified_at": "2026-05-21"
}
