{
  "id": "dietitian",
  "title_he": "תזונאי/ת קליני/ת",
  "title_en": "Clinical Dietitian",
  "description_he": "ייעוץ תזונתי קליני — מטופלים עם סוכרת, בעיות לב, מערכת עיכול, ספורטאים, או אנשים שמחפשים שינוי באורח החיים. תואר ארבע שנים והתמחות. אפשרות לעבוד בקופות חולים, בבתי חולים, או בקליניקה עצמאית.",
  "riasec_affinity": { "R": 0.25, "I": 0.75, "A": 0.25, "S": 0.85, "E": 0.30, "C": 0.65 },
  "required_skills": [
    { "skill_id": "nutrition-science", "importance": 1.0 },
    { "skill_id": "anatomy", "importance": 0.85 },
    { "skill_id": "communication", "importance": 0.85 },
    { "skill_id": "empathy", "importance": 0.8 },
    { "skill_id": "counseling", "importance": 0.7 }
  ],
  "desired_skills": [
    { "skill_id": "self-direction", "importance": 0.55 }
  ],
  "values_fit": ["impact", "service", "balance", "stability"],
  "big5_fit": { "A": 70 },
  "constraints": {
    "typical_training_months": 48,
    "typical_training_cost_nis": 50000,
    "requires_english_level": "intermediate",
    "remote_ok": true,
    "typical_locations": ["כל הארץ"]
  },
  "market": {
    "demand_he": "medium",
    "typical_salary_nis_min": 10000,
    "typical_salary_nis_max": 20000,
    "ai_risk": "medium"
  },
  "data_source": "public_knowledge_v1_2026-05",
  "last_verified_at": "2026-05-21"
}
