{
  "id": "hr-recruiter",
  "title_he": "מגייס/ת / Talent Acquisition",
  "title_en": "Technical Recruiter / Talent Acquisition",
  "description_he": "איתור, סינון, וגיוס מועמדים עבור חברות — במיוחד בתעשיית ההייטק שבה הביקוש לכישרון גבוה. תפקיד שמשלב חיפוש (sourcing), שיחות אנושיות עם הרבה אנשים, ויכולת לפתות מועמדים. שילוב של אנשים, יעדים, וגמישות.",
  "riasec_affinity": { "R": 0.10, "I": 0.40, "A": 0.35, "S": 0.85, "E": 0.85, "C": 0.50 },
  "required_skills": [
    { "skill_id": "recruiting", "importance": 1.0 },
    { "skill_id": "communication", "importance": 0.95 },
    { "skill_id": "english-business", "importance": 0.85 },
    { "skill_id": "empathy", "importance": 0.7 },
    { "skill_id": "negotiation", "importance": 0.7 }
  ],
  "desired_skills": [
    { "skill_id": "self-direction", "importance": 0.6 },
    { "skill_id": "data-analysis", "importance": 0.4 }
  ],
  "values_fit": ["team", "money", "balance", "variety"],
  "big5_fit": { "E": 80, "A": 65 },
  "constraints": {
    "typical_training_months": 3,
    "typical_training_cost_nis": 5000,
    "requires_english_level": "advanced",
    "remote_ok": true,
    "typical_locations": ["מרכז", "תל אביב", "שרון", "כל הארץ"]
  },
  "market": {
    "demand_he": "high",
    "typical_salary_nis_min": 12000,
    "typical_salary_nis_max": 28000,
    "ai_risk": "medium"
  },
  "data_source": "public_knowledge_v1_2026-05",
  "last_verified_at": "2026-05-21"
}
