{
  "id": "speech-therapist",
  "title_he": "קלינאי/ת תקשורת",
  "title_en": "Speech-Language Pathologist",
  "description_he": "טיפול בילדים ומבוגרים עם הפרעות בדיבור, שפה, שמיעה, או בליעה. עבודה אחד-על-אחד או בקבוצות קטנות, בבתי ספר, מרפאות, או בית חולים. תואר אקדמי חובה. שילוב של מקצועיות קלינית עם רגישות אנושית גבוהה.",
  "riasec_affinity": { "R": 0.20, "I": 0.65, "A": 0.45, "S": 0.95, "E": 0.20, "C": 0.55 },
  "required_skills": [
    { "skill_id": "speech-therapy", "importance": 1.0 },
    { "skill_id": "empathy", "importance": 0.95 },
    { "skill_id": "patience", "importance": 0.9 },
    { "skill_id": "communication", "importance": 0.85 },
    { "skill_id": "child-development", "importance": 0.7 }
  ],
  "desired_skills": [
    { "skill_id": "anatomy", "importance": 0.6 },
    { "skill_id": "counseling", "importance": 0.55 }
  ],
  "values_fit": ["impact", "service", "stability"],
  "big5_fit": { "A": 80, "C": 65 },
  "constraints": {
    "typical_training_months": 48,
    "typical_training_cost_nis": 60000,
    "requires_english_level": "basic",
    "remote_ok": false,
    "typical_locations": ["כל הארץ"]
  },
  "market": {
    "demand_he": "high",
    "typical_salary_nis_min": 11000,
    "typical_salary_nis_max": 22000,
    "ai_risk": "low"
  },
  "data_source": "public_knowledge_v1_2026-05",
  "last_verified_at": "2026-05-21"
}
