{
  "id": "data-analyst",
  "title_he": "אנליסט/ית נתונים",
  "title_en": "Data Analyst",
  "description_he": "הפיכת נתונים גולמיים לתובנות עסקיות. שאילתות SQL, ניתוח ב-Python או R, בניית דשבורדים, ותרגום ממצאים לסיפור עבור בעלי תפקידים בעלי רקע לא טכני. תפקיד שמתאים למי שאוהב לפצח חידות מספריות וגם לתקשר אותן בבירור.",
  "riasec_affinity": { "R": 0.30, "I": 0.85, "A": 0.30, "S": 0.35, "E": 0.30, "C": 0.75 },
  "required_skills": [
    { "skill_id": "data-analysis", "importance": 1.0 },
    { "skill_id": "sql", "importance": 0.95 },
    { "skill_id": "python", "importance": 0.7 },
    { "skill_id": "statistics", "importance": 0.7 },
    { "skill_id": "spreadsheets", "importance": 0.7 },
    { "skill_id": "english-business", "importance": 0.6 }
  ],
  "desired_skills": [
    { "skill_id": "communication", "importance": 0.55 },
    { "skill_id": "presentation", "importance": 0.5 },
    { "skill_id": "attention-to-detail", "importance": 0.55 }
  ],
  "values_fit": ["learning", "challenge", "money", "stability"],
  "big5_fit": { "C": 75, "O": 65 },
  "constraints": {
    "typical_training_months": 8,
    "typical_training_cost_nis": 30000,
    "requires_english_level": "intermediate",
    "remote_ok": true,
    "typical_locations": ["מרכז", "תל אביב", "שרון", "חיפה"]
  },
  "market": {
    "demand_he": "very_high",
    "typical_salary_nis_min": 16000,
    "typical_salary_nis_max": 32000,
    "ai_risk": "medium"
  },
  "data_source": "public_knowledge_v1_2026-05",
  "last_verified_at": "2026-05-10"
}
