{
  "id": "mobile-developer",
  "title_he": "מפתח/ת אפליקציות Mobile",
  "title_en": "Mobile Developer (iOS/Android)",
  "description_he": "פיתוח אפליקציות לטלפונים — iOS, Android או cross-platform (React Native, Flutter). עבודה במגבלות חזקות של מסך קטן, סוללה, וקצב רשת, מה שהופך כל אפליקציה לאתגר הנדסי שמשלב חשיבה לוגית עם הבנת התנהגות משתמש בטלפון.",
  "riasec_affinity": { "R": 0.35, "I": 0.85, "A": 0.45, "S": 0.30, "E": 0.30, "C": 0.65 },
  "required_skills": [
    { "skill_id": "mobile-development", "importance": 1.0 },
    { "skill_id": "programming-general", "importance": 0.9 },
    { "skill_id": "problem-solving", "importance": 0.85 },
    { "skill_id": "english-business", "importance": 0.65 }
  ],
  "desired_skills": [
    { "skill_id": "javascript", "importance": 0.5 },
    { "skill_id": "ui-design", "importance": 0.45 },
    { "skill_id": "attention-to-detail", "importance": 0.65 }
  ],
  "values_fit": ["money", "learning", "creativity", "challenge"],
  "big5_fit": { "O": 70, "C": 65 },
  "constraints": {
    "typical_training_months": 10,
    "typical_training_cost_nis": 30000,
    "requires_english_level": "intermediate",
    "remote_ok": true,
    "typical_locations": ["מרכז", "תל אביב", "שרון"]
  },
  "market": {
    "demand_he": "high",
    "typical_salary_nis_min": 18000,
    "typical_salary_nis_max": 42000,
    "ai_risk": "medium"
  },
  "data_source": "public_knowledge_v1_2026-05",
  "last_verified_at": "2026-05-21"
}
