{
  "id": "operations-manager",
  "title_he": "מנהל/ת תפעול",
  "title_en": "Operations Manager",
  "description_he": "אחריות על שיגרת העבודה היומיומית של ארגון או יחידה — תהליכים, אנשים, ספקים, ולוחות זמנים. תיאום בין מחלקות, פתרון בעיות שצצות, ועמידה ביעדים תפעוליים. מסלול נפוץ ליוצאי/ות צבא עם רקע פיקודי שמחפשים תפקיד אנשים-ותהליכים.",
  "riasec_affinity": { "R": 0.30, "I": 0.40, "A": 0.20, "S": 0.65, "E": 0.85, "C": 0.80 },
  "required_skills": [
    { "skill_id": "operations", "importance": 1.0 },
    { "skill_id": "project-management", "importance": 0.85 },
    { "skill_id": "team-leadership", "importance": 0.85 },
    { "skill_id": "process-design", "importance": 0.75 },
    { "skill_id": "communication", "importance": 0.8 },
    { "skill_id": "spreadsheets", "importance": 0.6 }
  ],
  "desired_skills": [
    { "skill_id": "data-analysis", "importance": 0.5 },
    { "skill_id": "negotiation", "importance": 0.5 },
    { "skill_id": "stress-tolerance", "importance": 0.55 },
    { "skill_id": "english-business", "importance": 0.5 },
    { "skill_id": "time-management", "importance": 0.55 }
  ],
  "values_fit": ["challenge", "money", "team", "stability", "variety"],
  "big5_fit": { "E": 65, "C": 75 },
  "constraints": {
    "typical_training_months": 6,
    "typical_training_cost_nis": 12000,
    "requires_english_level": "intermediate",
    "remote_ok": false,
    "typical_locations": ["מרכז", "תל אביב", "שרון", "חיפה", "ירושלים", "צפון", "דרום", "באר שבע"]
  },
  "market": {
    "demand_he": "high",
    "typical_salary_nis_min": 14000,
    "typical_salary_nis_max": 30000,
    "ai_risk": "low"
  },
  "data_source": "public_knowledge_v1_2026-05",
  "last_verified_at": "2026-05-10"
}
