{
  "id": "ml-engineer",
  "title_he": "מהנדס/ת Machine Learning",
  "title_en": "Machine Learning Engineer",
  "description_he": "הגשר בין מדע הנתונים להנדסת תוכנה — לקחת מודל שמדען נתונים בנה ולהפוך אותו למערכת שרצה בייצור, מטפלת בהמוני בקשות, ומעדכנת את עצמה. תפקיד שמשלב יסודות ML עם מיומנויות backend וDevOps, ורלוונטי במיוחד בתעשיית ה-AI הצומחת.",
  "riasec_affinity": { "R": 0.30, "I": 1.00, "A": 0.20, "S": 0.20, "E": 0.30, "C": 0.75 },
  "required_skills": [
    { "skill_id": "machine-learning", "importance": 1.0 },
    { "skill_id": "python", "importance": 0.95 },
    { "skill_id": "programming-general", "importance": 0.85 },
    { "skill_id": "english-business", "importance": 0.75 }
  ],
  "desired_skills": [
    { "skill_id": "cloud", "importance": 0.6 },
    { "skill_id": "devops", "importance": 0.55 },
    { "skill_id": "statistics", "importance": 0.7 }
  ],
  "values_fit": ["learning", "challenge", "money", "impact"],
  "big5_fit": { "O": 80, "C": 75 },
  "constraints": {
    "typical_training_months": 24,
    "typical_training_cost_nis": 60000,
    "requires_english_level": "advanced",
    "remote_ok": true,
    "typical_locations": ["מרכז", "תל אביב", "שרון", "חיפה"]
  },
  "market": {
    "demand_he": "very_high",
    "typical_salary_nis_min": 25000,
    "typical_salary_nis_max": 65000,
    "ai_risk": "low"
  },
  "data_source": "public_knowledge_v1_2026-05",
  "last_verified_at": "2026-05-21"
}
