{
  "id": "devops-engineer",
  "title_he": "מהנדס/ת DevOps",
  "title_en": "DevOps Engineer",
  "description_he": "בניית ותחזוקת התשתית שמריצה מוצרי תוכנה — שרתים בענן, צינורות CI/CD, ניטור, ואבטחה. עבודה משולבת בין קוד למערכות הפעלה ורשתות, כולל כוננות לתקלות ייצור. תפקיד למי שאוהב מערכות יציבות ופתרון בעיות יישומיות.",
  "riasec_affinity": { "R": 0.65, "I": 0.80, "A": 0.20, "S": 0.30, "E": 0.25, "C": 0.75 },
  "required_skills": [
    { "skill_id": "devops", "importance": 1.0 },
    { "skill_id": "linux-cli", "importance": 0.9 },
    { "skill_id": "cloud", "importance": 0.9 },
    { "skill_id": "programming-general", "importance": 0.7 },
    { "skill_id": "english-business", "importance": 0.7 }
  ],
  "desired_skills": [
    { "skill_id": "python", "importance": 0.5 },
    { "skill_id": "safety", "importance": 0.4 },
    { "skill_id": "stress-tolerance", "importance": 0.5 },
    { "skill_id": "self-direction", "importance": 0.55 },
    { "skill_id": "problem-solving", "importance": 0.55 }
  ],
  "values_fit": ["money", "learning", "challenge", "stability"],
  "big5_fit": { "C": 75, "O": 60 },
  "constraints": {
    "typical_training_months": 6,
    "typical_training_cost_nis": 20000,
    "requires_english_level": "intermediate",
    "remote_ok": true,
    "typical_locations": ["מרכז", "תל אביב", "שרון", "חיפה"]
  },
  "market": {
    "demand_he": "very_high",
    "typical_salary_nis_min": 22000,
    "typical_salary_nis_max": 50000,
    "ai_risk": "medium"
  },
  "data_source": "public_knowledge_v1_2026-05",
  "last_verified_at": "2026-05-10"
}
