{
  "id": "data-scientist",
  "title_he": "מדען/ית נתונים",
  "title_en": "Data Scientist",
  "description_he": "שילוב של סטטיסטיקה, תכנות, ועסקים — בניית מודלים שמנבאים, מסווגים, או ממליצים. עבודה עם נתונים מורכבים, עם דגש על קביעת השאלה הנכונה לפני בניית הפתרון. דורש הבנה עמוקה במתמטיקה ובהקשר העסקי גם יחד.",
  "riasec_affinity": { "R": 0.20, "I": 1.00, "A": 0.30, "S": 0.30, "E": 0.40, "C": 0.70 },
  "required_skills": [
    { "skill_id": "python", "importance": 1.0 },
    { "skill_id": "statistics", "importance": 0.95 },
    { "skill_id": "data-analysis", "importance": 0.9 },
    { "skill_id": "machine-learning", "importance": 0.85 },
    { "skill_id": "sql", "importance": 0.75 },
    { "skill_id": "english-business", "importance": 0.7 }
  ],
  "desired_skills": [
    { "skill_id": "research-skills", "importance": 0.7 },
    { "skill_id": "presentation", "importance": 0.5 }
  ],
  "values_fit": ["learning", "challenge", "impact", "money"],
  "big5_fit": { "O": 80, "C": 70 },
  "constraints": {
    "typical_training_months": 18,
    "typical_training_cost_nis": 50000,
    "requires_english_level": "advanced",
    "remote_ok": true,
    "typical_locations": ["מרכז", "תל אביב", "שרון", "חיפה"]
  },
  "market": {
    "demand_he": "high",
    "typical_salary_nis_min": 22000,
    "typical_salary_nis_max": 55000,
    "ai_risk": "low"
  },
  "data_source": "public_knowledge_v1_2026-05",
  "last_verified_at": "2026-05-21"
}
