{
  "id": "financial-analyst",
  "title_he": "אנליסט/ית פיננסי/ת",
  "title_en": "Financial Analyst",
  "description_he": "ניתוח של חברות, השקעות, או תקציבים — בניית מודלים, הערכת ביצועים, ועזרה בקבלת החלטות עסקיות גדולות. תפקיד שמתאים למי שאוהב מספרים, אוהב להבין כיצד עסקים עובדים, ויש לו תשומת לב גבוהה לפרטים. רוב המעסיקים דורשים תואר בכלכלה, מנהל עסקים או חשבונאות.",
  "riasec_affinity": { "R": 0.10, "I": 0.85, "A": 0.15, "S": 0.20, "E": 0.65, "C": 0.90 },
  "required_skills": [
    { "skill_id": "financial-modeling", "importance": 1.0 },
    { "skill_id": "spreadsheets", "importance": 0.95 },
    { "skill_id": "data-analysis", "importance": 0.85 },
    { "skill_id": "attention-to-detail", "importance": 0.9 },
    { "skill_id": "english-business", "importance": 0.85 }
  ],
  "desired_skills": [
    { "skill_id": "presentation", "importance": 0.55 },
    { "skill_id": "accounting", "importance": 0.5 }
  ],
  "values_fit": ["money", "stability", "challenge", "status"],
  "big5_fit": { "C": 80 },
  "constraints": {
    "typical_training_months": 36,
    "typical_training_cost_nis": 60000,
    "requires_english_level": "advanced",
    "remote_ok": true,
    "typical_locations": ["מרכז", "תל אביב", "שרון"]
  },
  "market": {
    "demand_he": "high",
    "typical_salary_nis_min": 17000,
    "typical_salary_nis_max": 38000,
    "ai_risk": "medium"
  },
  "data_source": "public_knowledge_v1_2026-05",
  "last_verified_at": "2026-05-21"
}
