{
  "id": "customer-success-manager",
  "title_he": "מנהל/ת הצלחת לקוחות",
  "title_en": "Customer Success Manager",
  "description_he": "לקוחות גדולים אחרי שכבר רכשו — לוודא שהם מצליחים להשתמש במוצר, מרחיבים שימוש, ומחדשים מנוי. שילוב של ייעוץ, ניהול קשר, מעט מכירה, והרבה הקשבה. תפקיד אידיאלי למי שאוהב אנשים, מבין מוצר, ומעוניין בהשפעה אמיתית על לקוחות.",
  "riasec_affinity": { "R": 0.10, "I": 0.40, "A": 0.30, "S": 0.85, "E": 0.80, "C": 0.45 },
  "required_skills": [
    { "skill_id": "communication", "importance": 1.0 },
    { "skill_id": "empathy", "importance": 0.85 },
    { "skill_id": "english-business", "importance": 0.95 },
    { "skill_id": "customer-service", "importance": 0.8 },
    { "skill_id": "presentation", "importance": 0.65 }
  ],
  "desired_skills": [
    { "skill_id": "data-analysis", "importance": 0.45 },
    { "skill_id": "negotiation", "importance": 0.5 }
  ],
  "values_fit": ["team", "impact", "learning", "money", "balance"],
  "big5_fit": { "E": 75, "A": 70 },
  "constraints": {
    "typical_training_months": 3,
    "typical_training_cost_nis": 5000,
    "requires_english_level": "fluent",
    "remote_ok": true,
    "typical_locations": ["מרכז", "תל אביב", "שרון", "כל הארץ"]
  },
  "market": {
    "demand_he": "high",
    "typical_salary_nis_min": 14000,
    "typical_salary_nis_max": 28000,
    "ai_risk": "medium"
  },
  "data_source": "public_knowledge_v1_2026-05",
  "last_verified_at": "2026-05-21"
}
